"","GOterm","ParentTerm","Factor.x","term","bh_adjust_Up","bh_adjust_Down"
"778","GO:0032088","regulation of molecular function","Down","negative regulation of NF-kappaB transcription factor activity",NA,7.52462350982135e-06
"779","GO:0032091","regulation of molecular function","Down, Up","negative regulation of protein binding",3.33118867373775e-09,4.08103117242672e-07
"780","GO:0032092","regulation of molecular function","Down, Up","positive regulation of protein binding",3.139962179946e-07,5.34444750342907e-08
"781","GO:0032101","regulation of response to stimulus","Down, Up","regulation of response to external stimulus",4.67747226377128e-45,1.13389261792608e-32
"782","GO:0032102","regulation of response to stimulus","Down, Up","negative regulation of response to external stimulus",1.05412189683707e-14,1.9493874248683e-09
"783","GO:0032103","regulation of response to stimulus","Down, Up","positive regulation of response to external stimulus",1.12399881586601e-18,1.32325057469121e-14
"784","GO:0032147","regulation of molecular function","Down, Up","activation of protein kinase activity",1.12774291580269e-20,2.3734227177306e-13
"785","GO:0032200","cellular component organization or biogenesis","Down, Up","telomere organization",6.72391745493377e-08,1.80349681373714e-08
"786","GO:0032204","cellular component organization or biogenesis","Down, Up","regulation of telomere maintenance",1.37386888601716e-09,5.65211802845323e-09
"787","GO:0032231","regulation of cellular component organization","Up","regulation of actin filament bundle assembly",5.83976226541856e-09,NA
"788","GO:0032259","methylation","Down, Up","methylation",1.37493842125744e-21,9.40792467581089e-19
"789","GO:0032271","cellular component biogenesis","Down, Up","regulation of protein polymerization",1.52772944202143e-15,2.22735159711862e-13
"790","GO:0032273","cellular component biogenesis","Down, Up","positive regulation of protein polymerization",2.17202961063575e-08,8.56442818196505e-08
"791","GO:0032368","macromolecule localization","Down, Up","regulation of lipid transport",3.66679128912249e-08,4.738894386812e-06
"792","GO:0032386","regulation of localization","Down, Up","regulation of intracellular transport",6.45820205467879e-36,2.37401797847452e-28
"793","GO:0032387","regulation of localization","Down, Up","negative regulation of intracellular transport",3.30708011522475e-08,3.23523983009183e-06
"794","GO:0032388","regulation of localization","Down, Up","positive regulation of intracellular transport",5.88458772747881e-21,1.52070111515091e-13
"795","GO:0032392","cellular component organization or biogenesis","Down","DNA geometric change",NA,1.34573894771546e-06
"796","GO:0032409","regulation of molecular function","Down, Up","regulation of transporter activity",1.80068198812275e-10,4.81742262305603e-11
"797","GO:0032411","regulation of molecular function","Down","positive regulation of transporter activity",NA,1.32143754562621e-06
"798","GO:0032412","regulation of molecular function","Down, Up","regulation of monoatomic ion transmembrane transporter activity",1.67258388484919e-09,1.59524711125618e-10
"799","GO:0032434","regulation of metabolic process","Down, Up","regulation of proteasomal ubiquitin-dependent protein catabolic process",1.97524146064661e-11,2.68697587244839e-12
"800","GO:0032435","regulation of metabolic process","Down","negative regulation of proteasomal ubiquitin-dependent protein catabolic process",NA,1.33672819030736e-06
"801","GO:0032436","regulation of metabolic process","Down, Up","positive regulation of proteasomal ubiquitin-dependent protein catabolic process",1.97023654554685e-11,8.22936151585579e-07
"802","GO:0032446","macromolecule modification","Down, Up","protein modification by small protein conjugation",1.84024964926248e-31,4.49292927999503e-38
"803","GO:0032456","cellular localization","Up","endocytic recycling",2.25200403798135e-06,NA
"804","GO:0032465","cell division","Up","regulation of cytokinesis",6.21355547067923e-09,NA
"805","GO:0032501","multicellular organismal process","Down, Up","multicellular organismal process",0,0
"806","GO:0032502","developmental process","Down, Up","developmental process",0,0
"807","GO:0032504","reproduction","Down, Up","multicellular organism reproduction",2.6794131203891e-123,4.31795010594764e-116
"808","GO:0032507","maintenance of location","Down","maintenance of protein location in cell",NA,1.64166604326613e-06
"809","GO:0032508","cellular component organization or biogenesis","Down","DNA duplex unwinding",NA,1.34573894771546e-06
"810","GO:0032526","response to organic substance","Up","response to retinoic acid",4.29012293428815e-06,NA
"811","GO:0032535","regulation of biological quality","Down, Up","regulation of cellular component size",9.5778750040646e-39,1.82610461505392e-31
"812","GO:0032543","mitochondrial gene expression","Down, Up","mitochondrial translation",1.4245050268787e-08,3.33060383119488e-08
"813","GO:0032774","biosynthetic process","Down, Up","RNA biosynthetic process",1.47644486799349e-41,1.73937050521364e-58
"814","GO:0032781","regulation of molecular function","Up","positive regulation of ATP-dependent activity",1.1150817369338e-06,NA
"815","GO:0032784","biosynthetic process","Down","regulation of DNA-templated transcription elongation",NA,3.03686210200888e-06
"816","GO:0032787","small molecule metabolic process","Down, Up","monocarboxylic acid metabolic process",7.64460337448343e-28,4.73272050753547e-28
"817","GO:0032868","response to chemical, response to organic substance","Down, Up","response to insulin",2.21260144631954e-18,4.0091502634369e-16
"818","GO:0032869","response to chemical, response to organic substance","Down, Up","cellular response to insulin stimulus",1.9996743583796e-15,1.89392517291497e-12
"819","GO:0032870","response to chemical, response to organic substance","Down, Up","cellular response to hormone stimulus",4.88801176955715e-37,7.43027082235773e-34
"820","GO:0032872","regulation of cell communication, intracellular signal transduction","Down, Up","regulation of stress-activated MAPK cascade",4.30377302348533e-18,8.36405017383681e-12
"821","GO:0032873","regulation of cell communication","Down","negative regulation of stress-activated MAPK cascade",NA,4.77852629199429e-06
"822","GO:0032874","regulation of cell communication, intracellular signal transduction","Down, Up","positive regulation of stress-activated MAPK cascade",7.54744611811015e-12,5.27269214901384e-06
"823","GO:0032879","regulation of localization","Down, Up","regulation of localization",8.91676934194959e-160,2.74031962609594e-127
"824","GO:0032880","regulation of localization","Down, Up","regulation of protein localization",1.57140679410998e-68,2.01705008722925e-61
"825","GO:0032886","microtubule-based process","Down, Up","regulation of microtubule-based process",2.124622458324e-21,2.75131728789782e-12
"826","GO:0032890","regulation of localization","Up","regulation of organic acid transport",6.09485474545326e-06,NA
"827","GO:0032940","secretion","Down, Up","secretion by cell",5.43120766532494e-57,1.45783790642984e-55
"828","GO:0032956","actin filament-based process","Down, Up","regulation of actin cytoskeleton organization",8.41927210949078e-24,1.42548319586339e-20
"829","GO:0032970","actin filament-based process","Down, Up","regulation of actin filament-based process",4.07503750850789e-25,3.8635575578164e-22
"830","GO:0032981","cellular component biogenesis","Down","mitochondrial respiratory chain complex I assembly",NA,1.44359948200073e-07
"831","GO:0032984","protein-containing complex organization, cellular component disassembly","Down, Up","protein-containing complex disassembly",1.02722615372311e-22,7.02799154386057e-24
"832","GO:0032989","anatomical structure morphogenesis","Down, Up","cellular component morphogenesis",3.0299619637368e-85,8.40122603742168e-73
"833","GO:0032990","anatomical structure morphogenesis","Down, Up","cell part morphogenesis",2.30488266211659e-59,3.48917013901099e-48
"834","GO:0033036","macromolecule localization","Down, Up","macromolecule localization",1.19680082923122e-161,1.55426561139245e-136
"835","GO:0033043","regulation of cellular component organization","Down, Up","regulation of organelle organization",2.48268341193914e-99,1.76834000503168e-81
"836","GO:0033044","regulation of cellular component organization","Down, Up","regulation of chromosome organization",9.33970499473606e-34,3.83510515061189e-34
"837","GO:0033045","cell cycle","Down, Up","regulation of sister chromatid segregation",3.47040517849708e-09,6.89019411056373e-09
"838","GO:0033047","cell cycle","Up","regulation of mitotic sister chromatid segregation",3.16692955430098e-08,NA
"839","GO:0033108","cellular component organization or biogenesis","Down, Up","mitochondrial respiratory chain complex assembly",3.04449632372671e-06,4.45075072041595e-10
"840","GO:0033135","phosphorus metabolic process","Down, Up","regulation of peptidyl-serine phosphorylation",1.42129553558243e-06,4.97967946529862e-08
"841","GO:0033157","regulation of localization","Down, Up","regulation of intracellular protein transport",2.89015834206952e-22,2.59516914779128e-15
"842","GO:0033365","macromolecule localization","Down, Up","protein localization to organelle",6.15259585444372e-59,5.69068881177766e-60
"843","GO:0033500","homeostatic process","Down, Up","carbohydrate homeostasis",1.02599402401866e-14,1.24604859395985e-13
"844","GO:0033554","response to stress","Down, Up","cellular response to stress",2.3626549625288e-128,4.10746084466872e-117
"845","GO:0033673","regulation of molecular function","Down, Up","negative regulation of kinase activity",4.71168085045894e-19,3.81421021889501e-16
"846","GO:0033674","regulation of molecular function","Down, Up","positive regulation of kinase activity",3.25524918102687e-35,5.28012201089813e-25
"847","GO:0033865","small molecule metabolic process","Down","nucleoside bisphosphate metabolic process",NA,4.18237026079551e-08
"848","GO:0033875","small molecule metabolic process","Down","ribonucleoside bisphosphate metabolic process",NA,4.18237026079551e-08
"849","GO:0033993","response to chemical, response to organic substance","Down, Up","response to lipid",1.40026294541213e-48,1.87023464059154e-43
"850","GO:0034032","small molecule metabolic process","Down","purine nucleoside bisphosphate metabolic process",NA,4.18237026079551e-08
"851","GO:0034097","response to chemical, response to organic substance","Down, Up","response to cytokine",1.5598174137932e-45,1.26858752707241e-40
"852","GO:0034220","localization","Down, Up","monoatomic ion transmembrane transport",6.62132053053607e-35,1.13754387215403e-32
"853","GO:0034248","amide metabolic process","Down, Up","regulation of amide metabolic process",1.11706359955826e-34,4.73558265639277e-30
"854","GO:0034249","amide metabolic process","Down, Up","negative regulation of amide metabolic process",8.13560378183225e-13,1.58648408551506e-10
"855","GO:0034250","amide metabolic process","Down, Up","positive regulation of amide metabolic process",5.17335559661813e-16,1.1537705113037e-09
"856","GO:0034284","response to chemical, response to organic substance","Down, Up","response to monosaccharide",7.22338279339841e-12,4.75934507688344e-09
"857","GO:0034329","synapse organization","Down, Up","cell junction assembly",7.6221582760978e-11,7.64503966283459e-10
"858","GO:0034330","synapse organization","Down, Up","cell junction organization",3.84678774596038e-14,3.00801126878264e-12
"859","GO:0034332","synapse organization","Up","adherens junction organization",2.36731039854624e-07,NA
"860","GO:0034404","small molecule metabolic process","Down, Up","nucleobase-containing small molecule biosynthetic process",5.68624648706104e-08,8.58768455021704e-09
"861","GO:0034440","lipid metabolic process","Up","lipid oxidation",5.68582919235153e-06,NA
"862","GO:0034470","RNA processing","Down, Up","ncRNA processing",8.93487379397087e-28,1.45770925304748e-37
"863","GO:0034502","macromolecule localization","Up","protein localization to chromosome",1.51086654965632e-07,NA
"864","GO:0034504","macromolecule localization","Down, Up","protein localization to nucleus",3.79104712023398e-17,3.46639258646498e-16
"865","GO:0034599","response to stress","Down, Up","cellular response to oxidative stress",1.65426297197968e-18,2.05017846619555e-16
"866","GO:0034605","response to abiotic stimulus","Up","cellular response to heat",3.54263159319182e-08,NA
"867","GO:0034612","response to chemical, response to organic substance","Down, Up","response to tumor necrosis factor",7.02828280145351e-07,2.10032518009765e-08
"868","GO:0034614","response to stress","Down, Up","cellular response to reactive oxygen species",7.54206543625921e-10,9.75378654496783e-10
"869","GO:0034620","response to chemical, response to organic substance","Down, Up","cellular response to unfolded protein",1.70959135495595e-12,5.80822719555475e-11
"870","GO:0034641","metabolic process","Down, Up","cellular nitrogen compound metabolic process",4.98098188761677e-255,3.54989191065741e-305
"871","GO:0034644","cellular response to environmental stimulus","Down, Up","cellular response to UV",3.43250422889339e-10,1.63389458344002e-06
"872","GO:0034645","cellular macromolecule metabolic process","Down, Up","cellular macromolecule biosynthetic process",2.85510780953365e-111,6.37045557737209e-160
"873","GO:0034654","biosynthetic process","Down, Up","nucleobase-containing compound biosynthetic process",5.4144666262012e-74,3.41747240485035e-90
"874","GO:0034655","catabolic process","Down, Up","nucleobase-containing compound catabolic process",1.03733020095554e-23,7.39301060265509e-48
"875","GO:0034660","RNA processing","Down, Up","ncRNA metabolic process",7.32056763373868e-40,2.25423069756922e-52
"876","GO:0034728","protein-containing complex organization","Down, Up","nucleosome organization",6.15645285867969e-07,3.16650172350233e-07
"877","GO:0034762","regulation of localization","Down, Up","regulation of transmembrane transport",1.20132997975273e-20,4.06736748206521e-17
"878","GO:0034763","regulation of localization","Down, Up","negative regulation of transmembrane transport",5.22283454523165e-06,5.59393669114112e-06
"879","GO:0034764","regulation of localization","Down, Up","positive regulation of transmembrane transport",1.6798618897697e-10,2.53719897084242e-11
"880","GO:0034765","regulation of localization","Down, Up","regulation of monoatomic ion transmembrane transport",1.00829692783869e-14,1.37806920455006e-12
"881","GO:0034767","regulation of localization","Down, Up","positive regulation of monoatomic ion transmembrane transport",1.16069123388364e-06,4.31040990745768e-07
"882","GO:0034968","macromolecule modification","Down","histone lysine methylation",NA,2.09711796683749e-06
"883","GO:0034976","response to stress","Down, Up","response to endoplasmic reticulum stress",6.0464836709714e-26,4.34971295005581e-25
"884","GO:0035023","intracellular signal transduction","Up","regulation of Rho protein signal transduction",8.10543815307332e-06,NA
"885","GO:0035082","microtubule bundle formation, microtubule-based process","Down, Up","axoneme assembly",2.75802646811854e-08,6.58535926364143e-09
"886","GO:0035088","establishment or maintenance of cell polarity","Down, Up","establishment or maintenance of apical/basal cell polarity",1.02665503800847e-06,5.27269214901384e-06
"887","GO:0035148","tube development","Down, Up","tube formation",5.82278069406879e-17,3.11503970972701e-18
"888","GO:0035150","regulation of biological quality","Down, Up","regulation of tube size",2.38435707211194e-14,8.09120401923024e-09
"889","GO:0035194","regulation of metabolic process","Down, Up","RNA-mediated post-transcriptional gene silencing",3.03760854844097e-07,1.13332869143873e-06
"890","GO:0035239","tube development","Down, Up","tube morphogenesis",3.23550466700373e-77,4.89607466011131e-58
"891","GO:0035264","regulation of growth","Down, Up","multicellular organism growth",8.18024060474519e-10,9.22516712628368e-07
"892","GO:0035265","regulation of growth","Up","organ growth",3.31361608598116e-08,NA
"893","GO:0035282","pattern specification process","Down, Up","segmentation",2.24818640037836e-22,9.4750088450547e-25
"894","GO:0035295","tube development","Down, Up","tube development",3.36046757824781e-97,2.56180255759888e-79
"895","GO:0035303","organophosphate metabolic process, phosphorus metabolic process","Down, Up","regulation of dephosphorylation",3.50762518710215e-12,2.48142437258779e-10
"896","GO:0035304","organophosphate metabolic process, phosphorus metabolic process","Down, Up","regulation of protein dephosphorylation",1.27446112651377e-08,2.31580607260367e-06
"897","GO:0035305","organophosphate metabolic process, phosphorus metabolic process","Down, Up","negative regulation of dephosphorylation",5.15539390282137e-06,7.84923570660028e-06
"898","GO:0035556","regulation of cell communication, intracellular signal transduction","Down, Up","intracellular signal transduction",1.39549442357454e-82,2.37190197070409e-69
"899","GO:0035567","cell-cell signaling, cell communication","Down, Up","non-canonical Wnt signaling pathway",1.97945278881809e-07,3.68768802676726e-06
"900","GO:0035601","macromolecule modification","Down","protein deacylation",NA,2.27041693694009e-06
"901","GO:0035821","biological process involved in interspecies interaction between organisms","Down","modulation of process of another organism",NA,3.45886494272874e-08
"902","GO:0035966","response to chemical, response to organic substance","Down, Up","response to topologically incorrect protein",4.02388099536208e-17,4.09813586228366e-15
"903","GO:0035967","response to chemical, response to organic substance","Down, Up","cellular response to topologically incorrect protein",1.83190835022047e-13,8.25529077717306e-14
"904","GO:0036211","macromolecule modification","Down, Up","protein modification process",4.32899105681491e-170,8.40582088034765e-177
"905","GO:0036293","response to abiotic stimulus","Down, Up","response to decreased oxygen levels",8.40420324783764e-22,7.70652222541422e-22
"906","GO:0036294","response to abiotic stimulus","Down, Up","cellular response to decreased oxygen levels",2.70531891676361e-08,7.49567793902209e-13
"907","GO:0036465","vesicle-mediated transport","Down","synaptic vesicle recycling",NA,3.46119374381863e-07
"908","GO:0036498","response to organic substance","Up","IRE1-mediated unfolded protein response",6.22252147022611e-07,NA
"909","GO:0036503","proteolysis","Down, Up","ERAD pathway",3.62170001809032e-08,7.34972816082823e-09
"910","GO:0038127","cell surface receptor signaling pathway","Up","ERBB signaling pathway",2.25055032873073e-06,NA
"911","GO:0040001","organelle localization","Up","establishment of mitotic spindle localization",2.51276535512413e-07,NA
"912","GO:0040007","regulation of growth","Down, Up","growth",5.97703300895962e-42,1.3230499644294e-47
"913","GO:0040008","regulation of growth","Down, Up","regulation of growth",1.1785797965265e-70,8.92651804188191e-62
"914","GO:0040011","locomotion","Down, Up","locomotion",7.18042796886723e-101,2.8069360647403e-86
"915","GO:0040012","locomotion","Down, Up","regulation of locomotion",1.86466482330652e-62,4.78535474871226e-51
"916","GO:0040013","locomotion","Down, Up","negative regulation of locomotion",4.25764099203834e-15,3.19418843491315e-11
"917","GO:0040014","regulation of growth","Down, Up","regulation of multicellular organism growth",4.31662966562478e-16,9.11308658874551e-13
"918","GO:0040017","locomotion","Down, Up","positive regulation of locomotion",9.51403007531679e-37,3.21138785645927e-28
"919","GO:0040018","regulation of growth","Down, Up","positive regulation of multicellular organism growth",6.06936786662722e-08,1.24766445215036e-08
"920","GO:0040024","post-embryonic development","Down","dauer larval development",NA,1.44370397325697e-07
"921","GO:0040025","animal organ development","Down","vulval development",NA,3.72397897083259e-06
"922","GO:0040028","animal organ development","Down, Up","regulation of vulval development",2.70499185827271e-06,6.13767426159595e-06
"923","GO:0040029","chromatin organization","Down, Up","epigenetic regulation of gene expression",1.84320946582875e-23,3.03304388465913e-23
"924","GO:0042048","behavior","Down, Up","olfactory behavior",6.72001579255109e-07,2.30155594685661e-07
"925","GO:0042058","signaling, cell surface receptor signaling pathway","Down, Up","regulation of epidermal growth factor receptor signaling pathway",1.86902667114718e-11,1.73788710013014e-08
"926","GO:0042059","signaling, cell surface receptor signaling pathway","Down, Up","negative regulation of epidermal growth factor receptor signaling pathway",1.47663371890389e-08,7.06201511646547e-06
"927","GO:0042060","response to stress, defense response","Down, Up","wound healing",2.9149772860495e-30,2.78847757407761e-26
"928","GO:0042063","system development","Down, Up","gliogenesis",4.79753942146896e-20,3.30870365258919e-10
"929","GO:0042113","cell activation","Down, Up","B cell activation",4.3065804919616e-10,4.64688259943548e-09
"930","GO:0042127","regulation of cell population proliferation","Down, Up","regulation of cell population proliferation",3.0299619637368e-85,1.5170042528086e-76
"931","GO:0042133","regulation of biological quality","Up","neurotransmitter metabolic process",2.86436092808605e-06,NA
"932","GO:0042147","cellular localization","Down, Up","retrograde transport, endosome to Golgi",3.56331156611241e-08,4.24450975918355e-06
"933","GO:0042157","protein maturation","Down","lipoprotein metabolic process",NA,7.54798708619308e-07
"934","GO:0042176","catabolic process","Down, Up","regulation of protein catabolic process",2.02820219747604e-32,2.81033835924497e-25
"935","GO:0042177","catabolic process","Down, Up","negative regulation of protein catabolic process",3.26926911249325e-08,1.20803282266255e-11
"936","GO:0042180","small molecule metabolic process","Down","cellular ketone metabolic process",NA,2.05413447277022e-06
"937","GO:0042221","response to chemical","Down, Up","response to chemical",6.42453223457732e-229,2.14256320609171e-210
"938","GO:0042254","cellular component biogenesis","Down, Up","ribosome biogenesis",4.03834716757202e-23,1.92305584202681e-37
"939","GO:0042255","cellular component biogenesis","Down","ribosome assembly",NA,1.61254724975433e-11
"940","GO:0042273","cellular component biogenesis","Down","ribosomal large subunit biogenesis",NA,3.633880011189e-12
"941","GO:0042274","cellular component biogenesis","Down, Up","ribosomal small subunit biogenesis",5.79850098257577e-08,1.02909919104218e-13
"942","GO:0042278","carbohydrate derivative metabolic process","Up","purine nucleoside metabolic process",1.74845938806979e-06,NA
"943","GO:0042303","molting cycle","Down, Up","molting cycle",4.30822980478394e-15,6.19993396364937e-13
"944","GO:0042306","regulation of localization","Up","regulation of protein import into nucleus",6.9799660333026e-09,NA
"945","GO:0042325","phosphorus metabolic process","Down, Up","regulation of phosphorylation",1.91475381993533e-80,3.35732838539149e-70
"946","GO:0042326","phosphorus metabolic process","Down, Up","negative regulation of phosphorylation",3.19376269259505e-29,3.43990917080379e-27
"947","GO:0042327","phosphorus metabolic process","Down, Up","positive regulation of phosphorylation",2.47187931001874e-55,2.49643095868509e-44
"948","GO:0042330","response to external stimulus, locomotion","Down, Up","taxis",1.14606570075048e-38,4.70912075686613e-39
"949","GO:0042335","developmental process","Down, Up","cuticle development",1.70531770721044e-10,1.91396565609547e-09
"950","GO:0042391","regulation of biological quality","Down, Up","regulation of membrane potential",1.25190434386112e-19,6.85568843664576e-19
"951","GO:0042398","cellular modified amino acid metabolic process","Down","cellular modified amino acid biosynthetic process",NA,4.31588787970648e-06
"952","GO:0042440","pigment metabolic process","Down, Up","pigment metabolic process",1.42083575963355e-11,4.46218467823001e-07
"953","GO:0042445","regulation of biological quality","Down, Up","hormone metabolic process",7.35266553243794e-10,5.20516871001862e-12
"954","GO:0042490","system development","Up","mechanoreceptor differentiation",1.36706467455113e-07,NA
"955","GO:0042542","response to stress, response to organic substance","Down, Up","response to hydrogen peroxide",6.88725334087478e-09,5.80310945277596e-08
"956","GO:0042551","developmental maturation","Up","neuron maturation",2.60878554264156e-06,NA
"957","GO:0042592","homeostatic process","Down, Up","homeostatic process",1.76180403635843e-100,7.38498369919917e-86
"958","GO:0042593","homeostatic process","Down, Up","glucose homeostasis",2.21376626481782e-14,1.44297446272118e-12
"959","GO:0042594","response to external stimulus","Down, Up","response to starvation",5.17394531411319e-21,3.42631184543907e-21
"960","GO:0042632","homeostatic process","Up","cholesterol homeostasis",1.30623395126783e-06,NA
"961","GO:0042659","cell fate commitment","Down, Up","regulation of cell fate specification",1.44350223235142e-07,4.54165940069312e-06
"962","GO:0042692","muscle structure development","Down, Up","muscle cell differentiation",1.32070187733966e-21,3.18070281730271e-26
"963","GO:0042742","response to biotic stimulus","Down, Up","defense response to bacterium",5.14901165039594e-18,3.86074275491216e-15
"964","GO:0042752","rhythmic process","Down, Up","regulation of circadian rhythm",1.0771437233601e-08,1.66063964491261e-07
"965","GO:0042770","intracellular signal transduction","Up","signal transduction in response to DNA damage",5.85014019880722e-07,NA
"966","GO:0042773","generation of precursor metabolites and energy","Down","ATP synthesis coupled electron transport",NA,6.46906147185442e-11
"967","GO:0042775","generation of precursor metabolites and energy","Down","mitochondrial ATP synthesis coupled electron transport",NA,6.46906147185442e-11
