"","GOterm","ParentTerm","Factor.x","term","bh_adjust_Up","bh_adjust_Down"
"1341","GO:0051253","negative regulation of biological process","Down, Up","negative regulation of RNA metabolic process",2.81618755259421e-80,7.43974748792577e-69
"1342","GO:0051254","positive regulation of biological process","Down, Up","positive regulation of RNA metabolic process",1.27192538042623e-95,9.18759217387268e-95
"1343","GO:0051258","protein-containing complex organization","Up","protein polymerization",5.50437379510802e-06,NA
"1344","GO:0051259","cellular component biogenesis, protein-containing complex organization","Down, Up","protein complex oligomerization",2.49981148289447e-29,3.81233737336321e-28
"1345","GO:0051260","cellular component biogenesis, protein-containing complex organization","Down, Up","protein homooligomerization",4.79818765808549e-16,9.42834847529927e-16
"1346","GO:0051262","cellular component biogenesis, protein-containing complex organization","Down, Up","protein tetramerization",7.07987317440562e-09,8.29907033385656e-09
"1347","GO:0051276","cellular component organization or biogenesis","Down, Up","chromosome organization",2.17208066473596e-72,6.93021694084434e-77
"1348","GO:0051282","homeostatic process","Up","regulation of sequestering of calcium ion",3.03538548203405e-07,NA
"1349","GO:0051293","organelle localization","Down, Up","establishment of spindle localization",2.74489329305325e-08,1.39278323014616e-07
"1350","GO:0051294","establishment or maintenance of cell polarity","Down, Up","establishment of spindle orientation",1.39885135239832e-06,4.14451072649629e-06
"1351","GO:0051301","cell division","Down, Up","cell division",1.06065060259796e-42,1.06101517186701e-30
"1352","GO:0051302","cell division","Down, Up","regulation of cell division",8.57651166372817e-16,3.86734155802286e-12
"1353","GO:0051303","organelle localization","Up","establishment of chromosome localization",1.50758176054395e-08,NA
"1354","GO:0051310","organelle localization","Up","metaphase plate congression",5.97950536083471e-07,NA
"1355","GO:0051321","cell cycle","Down, Up","meiotic cell cycle",5.27616477639216e-24,1.20305518006322e-20
"1356","GO:0051336","regulation of molecular function","Down, Up","regulation of hydrolase activity",3.63844286238253e-78,1.11908875531913e-48
"1357","GO:0051338","regulation of molecular function","Down, Up","regulation of transferase activity",5.09127186595556e-60,1.21836706367397e-56
"1358","GO:0051345","regulation of molecular function","Down, Up","positive regulation of hydrolase activity",1.88983831215374e-52,7.10750707465514e-31
"1359","GO:0051346","regulation of molecular function","Down, Up","negative regulation of hydrolase activity",5.70684361282646e-19,1.14543012759101e-15
"1360","GO:0051347","regulation of molecular function","Down, Up","positive regulation of transferase activity",1.07683237865949e-41,2.22085874143487e-32
"1361","GO:0051348","regulation of molecular function","Down, Up","negative regulation of transferase activity",9.61430694366422e-21,1.66942879563184e-21
"1362","GO:0051384","response to chemical, response to organic substance","Down, Up","response to glucocorticoid",5.20923238832292e-10,6.54225447838207e-10
"1363","GO:0051403","regulation of cell communication, intracellular signal transduction","Down, Up","stress-activated MAPK cascade",4.81270630215828e-12,4.74819051877292e-08
"1364","GO:0051438","regulation of molecular function","Down","regulation of ubiquitin-protein transferase activity",NA,8.61757943960276e-08
"1365","GO:0051480","homeostatic process","Down, Up","regulation of cytosolic calcium ion concentration",3.19447515323929e-12,2.92069480808924e-09
"1366","GO:0051489","cell projection organization","Up","regulation of filopodium assembly",2.30344736772049e-07,NA
"1367","GO:0051492","regulation of cellular component organization","Up","regulation of stress fiber assembly",5.79122895266555e-08,NA
"1368","GO:0051493","regulation of cellular component organization","Down, Up","regulation of cytoskeleton organization",3.36475652863726e-38,2.93217189760077e-30
"1369","GO:0051494","regulation of cellular component organization","Down, Up","negative regulation of cytoskeleton organization",9.62200447256115e-11,4.85469377614788e-07
"1370","GO:0051495","regulation of cellular component organization","Down, Up","positive regulation of cytoskeleton organization",3.03127217409503e-14,1.2038893306926e-12
"1371","GO:0051588","neurotransmitter transport","Down, Up","regulation of neurotransmitter transport",2.3117029280356e-06,8.91909129938704e-10
"1372","GO:0051591","response to organic substance","Up","response to cAMP",8.69064060427812e-06,NA
"1373","GO:0051592","response to chemical, response to organic substance","Down, Up","response to calcium ion",5.98520265250211e-08,2.11796602386743e-06
"1374","GO:0051603","catabolic process","Down, Up","proteolysis involved in protein catabolic process",1.57155103843881e-37,2.80360862545751e-36
"1375","GO:0051604","protein maturation, proteolysis","Down, Up","protein maturation",3.08065507756516e-16,7.86270123871661e-16
"1376","GO:0051606","response to stimulus, detection of stimulus","Down, Up","detection of stimulus",1.0786652121428e-15,4.69136081074462e-14
"1377","GO:0051640","organelle localization","Down, Up","organelle localization",3.51840731898812e-61,9.10070129768272e-44
"1378","GO:0051641","cellular localization","Down, Up","cellular localization",6.49019600570033e-190,3.05088144407942e-163
"1379","GO:0051646","organelle localization","Down","mitochondrion localization",NA,3.79078170030481e-06
"1380","GO:0051647","organelle localization","Up","nucleus localization",1.252545236278e-06,NA
"1381","GO:0051648","organelle localization","Down, Up","vesicle localization",2.61289904057897e-25,6.8894241993946e-17
"1382","GO:0051649","cellular localization","Down, Up","establishment of localization in cell",3.3613715286393e-146,2.1159507720692e-135
"1383","GO:0051650","organelle localization","Down, Up","establishment of vesicle localization",5.5930677191782e-25,6.8894241993946e-17
"1384","GO:0051651","maintenance of location","Down, Up","maintenance of location in cell",1.49535165810474e-08,9.58554676066141e-10
"1385","GO:0051653","organelle localization","Down, Up","spindle localization",6.26895029160102e-09,1.39278323014616e-07
"1386","GO:0051656","organelle localization","Down, Up","establishment of organelle localization",1.36788393475771e-47,1.29086919584195e-33
"1387","GO:0051668","cellular localization","Down, Up","localization within membrane",3.22227220136528e-07,1.33859803263931e-06
"1388","GO:0051701","biological process involved in interspecies interaction between organisms, biological process involved in symbiotic interaction","Down, Up","biological process involved in interaction with host",1.5318668589139e-07,5.29136127654867e-06
"1389","GO:0051707","response to biotic stimulus","Down, Up","response to other organism",2.89281084737053e-44,3.98583421460311e-48
"1390","GO:0051716","response to stimulus","Down, Up","cellular response to stimulus",9.15751907202987e-308,1.89645111074744e-267
"1391","GO:0051726","cell cycle","Down, Up","regulation of cell cycle",1.24377835959594e-91,2.5058590471864e-82
"1392","GO:0051781","cell division","Up","positive regulation of cell division",2.6398487158185e-09,NA
"1393","GO:0051783","cellular component organization or biogenesis","Down, Up","regulation of nuclear division",8.077865007756e-23,8.28625729062058e-12
"1394","GO:0051784","cellular component organization or biogenesis","Up","negative regulation of nuclear division",1.3039324491589e-07,NA
"1395","GO:0051881","regulation of biological quality","Down, Up","regulation of mitochondrial membrane potential",5.48050322308003e-06,1.1133594151281e-06
"1396","GO:0051896","regulation of cell communication, intracellular signal transduction","Down, Up","regulation of protein kinase B signaling",4.25920698881861e-11,7.22502896445558e-06
"1397","GO:0051897","intracellular signal transduction","Up","positive regulation of protein kinase B signaling",1.75600960761731e-09,NA
"1398","GO:0051924","regulation of localization, monoatomic ion transport","Down, Up","regulation of calcium ion transport",1.24001064364656e-10,4.07886816654182e-08
"1399","GO:0051952","regulation of localization","Down","regulation of amine transport",NA,3.61513280957677e-06
"1400","GO:0051960","regulation of developmental process, regulation of multicellular organismal process","Down, Up","regulation of nervous system development",3.12438525519713e-86,6.08964447028568e-63
"1401","GO:0051961","regulation of multicellular organismal process","Down, Up","negative regulation of nervous system development",5.38182970001602e-33,2.81962707653491e-25
"1402","GO:0051962","regulation of developmental process, regulation of multicellular organismal process","Down, Up","positive regulation of nervous system development",2.840747866523e-51,4.74658123975362e-30
"1403","GO:0051963","synapse organization","Down, Up","regulation of synapse assembly",2.44959585812726e-18,5.90988304512358e-14
"1404","GO:0051964","regulation of biological quality","Up","negative regulation of synapse assembly",1.41531361937614e-06,NA
"1405","GO:0051965","cellular component biogenesis","Up","positive regulation of synapse assembly",1.60130658534523e-07,NA
"1406","GO:0051983","cell cycle","Down, Up","regulation of chromosome segregation",8.40162920066598e-11,6.37854494190509e-10
"1407","GO:0052547","regulation of molecular function, regulation of metabolic process","Down, Up","regulation of peptidase activity",6.99188514224273e-21,1.36824480308449e-14
"1408","GO:0052548","regulation of molecular function, regulation of metabolic process","Down, Up","regulation of endopeptidase activity",3.21489862853348e-19,4.48686638233054e-14
"1409","GO:0055001","muscle structure development","Down, Up","muscle cell development",2.28094307436392e-12,3.3806408748778e-14
"1410","GO:0055002","muscle structure development","Down, Up","striated muscle cell development",1.00995129705544e-11,3.58317495557238e-12
"1411","GO:0055057","regulation of cell population proliferation","Up","neuroblast division",6.79911557967373e-07,NA
"1412","GO:0055074","homeostatic process","Down, Up","calcium ion homeostasis",9.22758541994079e-21,1.33885342177161e-16
"1413","GO:0055080","homeostatic process","Down, Up","monoatomic cation homeostasis",1.10104306125471e-34,3.14731300747305e-25
"1414","GO:0055081","homeostatic process","Down, Up","monoatomic anion homeostasis",2.39245862655581e-06,7.79361843991094e-06
"1415","GO:0055082","homeostatic process","Down, Up","intracellular chemical homeostasis",1.1014537205514e-38,7.33805420318568e-31
"1416","GO:0055085","localization","Down, Up","transmembrane transport",8.68568399237034e-47,1.8849989567628e-41
"1417","GO:0055086","small molecule metabolic process","Down, Up","nucleobase-containing small molecule metabolic process",4.14530369276093e-43,3.22236937844972e-55
"1418","GO:0055088","homeostatic process","Down, Up","lipid homeostasis",1.08735150675059e-13,2.08972190154225e-08
"1419","GO:0055092","homeostatic process","Up","sterol homeostasis",1.30623395126783e-06,NA
"1420","GO:0055123","system development","Down, Up","digestive system development",1.96118501475623e-23,4.91126735567269e-17
"1421","GO:0060070","cell communication","Up","canonical Wnt signaling pathway",1.02176000663043e-07,NA
"1422","GO:0060249","homeostatic process","Down, Up","anatomical structure homeostasis",1.12708991574392e-28,2.7494929271987e-31
"1423","GO:0060255","regulation of metabolic process","Down, Up","regulation of macromolecule metabolic process",0,3.60039552563266e-295
"1424","GO:0060271","cell projection organization","Down, Up","cilium assembly",3.93549472691211e-32,1.75930373774342e-25
"1425","GO:0060284","regulation of developmental process","Down, Up","regulation of cell development",3.37485041548567e-79,6.13116119435519e-65
"1426","GO:0060322","head development","Down, Up","head development",1.43874538372347e-58,3.22378521301297e-55
"1427","GO:0060341","regulation of localization","Down, Up","regulation of cellular localization",9.818321226573e-65,1.51232627951148e-58
"1428","GO:0060429","tissue development","Down, Up","epithelium development",6.32623620495755e-117,5.39171827947304e-108
"1429","GO:0060485","tissue development","Down, Up","mesenchyme development",1.64336980367303e-14,5.05371012303212e-10
"1430","GO:0060491","cell projection organization","Down, Up","regulation of cell projection assembly",3.59373101648802e-16,1.2135037507715e-09
"1431","GO:0060537","tissue development","Down, Up","muscle tissue development",1.8257599914761e-22,5.6705344047762e-19
"1432","GO:0060538","muscle structure development","Down, Up","skeletal muscle organ development",1.98040580679782e-13,8.59369171910587e-14
"1433","GO:0060548","regulation of cell death","Down, Up","negative regulation of cell death",2.4773127218799e-65,7.43741830970302e-61
"1434","GO:0060560","regulation of growth","Down, Up","developmental growth involved in morphogenesis",6.73588769072123e-18,4.57146851295137e-17
"1435","GO:0060562","tube development","Down, Up","epithelial tube morphogenesis",2.14391677572298e-61,2.65652660293198e-45
"1436","GO:0060627","regulation of localization","Down, Up","regulation of vesicle-mediated transport",2.61042416252174e-43,5.10573627114429e-35
"1437","GO:0060795","embryo development","Up","cell fate commitment involved in formation of primary germ layer",4.97686967147377e-06,NA
"1438","GO:0060828","cell-cell signaling, cell communication","Down, Up","regulation of canonical Wnt signaling pathway",5.46823617586909e-23,4.3334688676271e-16
"1439","GO:0060998","cell projection organization","Up","regulation of dendritic spine development",1.2631683210973e-06,NA
"1440","GO:0061013","RNA processing","Down, Up","regulation of mRNA catabolic process",1.29494488552298e-09,6.84775610619506e-09
"1441","GO:0061024","membrane organization","Down, Up","membrane organization",1.2684547568903e-49,4.82627723263017e-48
"1442","GO:0061025","membrane organization","Down, Up","membrane fusion",3.60290684046984e-10,5.04319428337805e-13
"1443","GO:0061041","defense response","Up","regulation of wound healing",5.8299737388289e-10,NA
"1444","GO:0061061","muscle structure development","Down, Up","muscle structure development",7.2387030048115e-41,1.19870066371173e-42
"1445","GO:0061062","regulation of developmental process, regulation of multicellular organismal process","Down, Up","regulation of nematode larval development",3.72714887096768e-10,4.21647319441312e-11
"1446","GO:0061077","protein folding","Down, Up","chaperone-mediated protein folding",1.42035521084343e-10,3.45964272616866e-07
"1447","GO:0061097","peptidyl-amino acid modification","Up","regulation of protein tyrosine kinase activity",6.11574729473862e-06,NA
"1448","GO:0061136","regulation of metabolic process","Down, Up","regulation of proteasomal protein catabolic process",5.62046992348826e-16,1.80598507625213e-16
"1449","GO:0061138","anatomical structure morphogenesis","Down, Up","morphogenesis of a branching epithelium",1.66145691373574e-18,8.87649722340612e-09
"1450","GO:0061245","establishment or maintenance of cell polarity","Down, Up","establishment or maintenance of bipolar cell polarity",1.02665503800847e-06,5.27269214901384e-06
"1451","GO:0061351","regulation of cell population proliferation","Down, Up","neural precursor cell proliferation",1.57532337638206e-14,4.05372851376404e-08
"1452","GO:0061387","regulation of growth","Down, Up","regulation of extent of cell growth",4.13387602987242e-12,2.13269643154925e-07
"1453","GO:0061458","system development","Down, Up","reproductive system development",1.87131826924055e-40,7.5454076246053e-37
"1454","GO:0061525","system development","Down","hindgut development",NA,7.74244630729932e-06
"1455","GO:0061564","system development","Down, Up","axon development",9.56068948584695e-42,5.15122466622552e-37
"1456","GO:0061640","cell division","Down, Up","cytoskeleton-dependent cytokinesis",2.53513651713286e-17,9.8427548099272e-16
"1457","GO:0061919","regulation of autophagy","Down, Up","process utilizing autophagic mechanism",6.59447547869074e-16,5.02305796845322e-15
"1458","GO:0061982","cell cycle","Down, Up","meiosis I cell cycle process",2.18967019303208e-12,1.67496222611494e-08
"1459","GO:0062012","small molecule metabolic process","Down, Up","regulation of small molecule metabolic process",1.35048317233976e-23,8.74988790978578e-19
"1460","GO:0062013","small molecule metabolic process","Down, Up","positive regulation of small molecule metabolic process",1.1124218992908e-07,3.61614262477999e-09
"1461","GO:0062014","small molecule metabolic process","Up","negative regulation of small molecule metabolic process",9.32643866835332e-06,NA
"1462","GO:0065003","protein-containing complex organization","Down, Up","protein-containing complex assembly",6.93390187833151e-105,2.43911300492989e-106
"1463","GO:0065004","protein-containing complex organization","Down, Up","protein-DNA complex assembly",4.347609510692e-13,1.98709300460023e-07
"1464","GO:0065007","regulation of cellular process","Down, Up","biological regulation",0,0
"1465","GO:0065008","regulation of biological quality","Down, Up","regulation of biological quality",6.22471393342895e-245,4.95400874265903e-221
"1466","GO:0065009","regulation of molecular function","Down, Up","regulation of molecular function",1.10222012928749e-176,4.37026836600696e-140
"1467","GO:0070085","glycosylation","Down, Up","glycosylation",1.00875015367354e-11,3.13127426317185e-14
"1468","GO:0070125","amide metabolic process","Down, Up","mitochondrial translational elongation",2.79246670156952e-06,9.06272901137123e-07
"1469","GO:0070126","protein-containing complex organization, cellular component disassembly","Down, Up","mitochondrial translational termination",2.78751451584916e-06,2.34043340705587e-06
"1470","GO:0070192","cellular component organization or biogenesis","Down","chromosome organization involved in meiotic cell cycle",NA,4.31588787970648e-06
"1471","GO:0070201","regulation of localization","Down, Up","regulation of establishment of protein localization",4.46914860195862e-48,1.44328582036363e-41
"1472","GO:0070252","actin filament-based process","Up","actin-mediated cell contraction",3.26063732948843e-06,NA
"1473","GO:0070302","regulation of cell communication, intracellular signal transduction","Down, Up","regulation of stress-activated protein kinase signaling cascade",4.30377302348533e-18,8.36405017383681e-12
"1474","GO:0070303","regulation of cell communication","Down","negative regulation of stress-activated protein kinase signaling cascade",NA,4.77852629199429e-06
"1475","GO:0070304","regulation of cell communication, intracellular signal transduction","Down, Up","positive regulation of stress-activated protein kinase signaling cascade",7.54744611811015e-12,5.27269214901384e-06
"1476","GO:0070372","regulation of cell communication, intracellular signal transduction","Down, Up","regulation of ERK1 and ERK2 cascade",7.6883254760917e-12,1.38913931787334e-06
"1477","GO:0070374","intracellular signal transduction","Up","positive regulation of ERK1 and ERK2 cascade",3.38961056795837e-09,NA
"1478","GO:0070482","response to abiotic stimulus","Down, Up","response to oxygen levels",7.39850702510034e-26,2.08571589330997e-24
"1479","GO:0070507","microtubule-based process","Down, Up","regulation of microtubule cytoskeleton organization",8.70667246343822e-18,6.44149798317298e-10
"1480","GO:0070570","developmental process","Up","regulation of neuron projection regeneration",6.61869461052909e-07,NA
"1481","GO:0070585","macromolecule localization","Down, Up","protein localization to mitochondrion",2.38525729569955e-06,4.10253801383309e-06
"1482","GO:0070588","monoatomic ion transport","Down, Up","calcium ion transmembrane transport",4.34192048231685e-10,8.49161728934658e-07
"1483","GO:0070646","macromolecule modification","Down, Up","protein modification by small protein removal",8.29218970816427e-19,7.48926924813414e-25
"1484","GO:0070647","macromolecule modification","Down, Up","protein modification by small protein conjugation or removal",4.22156264363516e-48,2.18729863713209e-61
"1485","GO:0070727","macromolecule localization","Down, Up","cellular macromolecule localization",1.30894891172779e-116,2.54683696449237e-104
"1486","GO:0070848","response to endogenous stimulus","Down, Up","response to growth factor",8.16582272059226e-36,1.58747640425181e-25
"1487","GO:0070887","response to chemical","Down, Up","cellular response to chemical stimulus",2.01213959406345e-151,3.79993848070077e-136
"1488","GO:0070925","cellular component biogenesis","Down, Up","organelle assembly",2.70902467446291e-69,4.47885515113148e-65
"1489","GO:0070972","macromolecule localization","Down, Up","protein localization to endoplasmic reticulum",8.93770061133627e-07,2.0126299438481e-24
"1490","GO:0071103","cellular component organization or biogenesis","Down, Up","DNA conformation change",1.35630119376109e-16,1.67709617422854e-16
"1491","GO:0071214","cellular response to environmental stimulus","Down, Up","cellular response to abiotic stimulus",1.20035356056838e-24,3.89489425489592e-18
"1492","GO:0071229","response to chemical","Down, Up","cellular response to acid chemical",1.35553820171459e-13,3.62147669057384e-08
"1493","GO:0071241","response to chemical","Down, Up","cellular response to inorganic substance",1.44908760403248e-12,2.24940870066189e-13
"1494","GO:0071248","response to chemical","Down, Up","cellular response to metal ion",3.04391954119873e-11,1.10925236370598e-10
"1495","GO:0071310","response to chemical, response to organic substance","Down, Up","cellular response to organic substance",3.36398096005591e-125,5.79755935861172e-111
"1496","GO:0071322","response to chemical","Down","cellular response to carbohydrate stimulus",NA,6.31186202883788e-07
"1497","GO:0071345","response to chemical, response to organic substance","Down, Up","cellular response to cytokine stimulus",3.42134292639204e-43,4.05828319698682e-34
"1498","GO:0071356","response to chemical","Down","cellular response to tumor necrosis factor",NA,8.96690412051492e-07
"1499","GO:0071363","response to endogenous stimulus","Down, Up","cellular response to growth factor stimulus",3.77040306053904e-35,5.71563066044512e-25
"1500","GO:0071375","response to chemical, response to organic substance","Down, Up","cellular response to peptide hormone stimulus",3.71733041397415e-19,5.25098821800555e-16
"1501","GO:0071383","response to chemical, response to organic substance","Down, Up","cellular response to steroid hormone stimulus",2.52029112771698e-11,6.98630161478138e-11
"1502","GO:0071396","response to chemical, response to organic substance","Down, Up","cellular response to lipid",5.89956020544971e-29,4.05645897944125e-25
"1503","GO:0071407","response to chemical, response to organic substance","Down, Up","cellular response to organic cyclic compound",9.9008885841782e-33,8.93864882312029e-34
"1504","GO:0071417","response to chemical, response to organic substance","Down, Up","cellular response to organonitrogen compound",5.52822760818001e-37,2.76850543033944e-29
"1505","GO:0071453","response to abiotic stimulus","Down, Up","cellular response to oxygen levels",5.47901151119964e-10,7.49567793902209e-13
"1506","GO:0071456","response to abiotic stimulus","Down, Up","cellular response to hypoxia",2.66056245453209e-07,2.48174112541067e-12
"1507","GO:0071466","response to xenobiotic stimulus","Down, Up","cellular response to xenobiotic stimulus",6.184672399713e-08,1.09045388133848e-08
"1508","GO:0071478","cellular response to environmental stimulus","Down, Up","cellular response to radiation",4.68256156367912e-18,1.32794520228339e-12
"1509","GO:0071479","cellular response to environmental stimulus","Up","cellular response to ionizing radiation",6.01119453117175e-07,NA
"1510","GO:0071482","cellular response to environmental stimulus","Down, Up","cellular response to light stimulus",8.34184334757009e-12,7.0395017772825e-10
"1511","GO:0071495","response to endogenous stimulus","Down, Up","cellular response to endogenous stimulus",2.97883536301384e-74,2.10252421383517e-61
"1512","GO:0071496","response to external stimulus","Down, Up","cellular response to external stimulus",1.22408493778336e-23,7.81531288846061e-23
"1513","GO:0071559","response to endogenous stimulus","Down, Up","response to transforming growth factor beta",3.07379208069439e-10,2.35905004552252e-09
"1514","GO:0071560","response to endogenous stimulus","Down, Up","cellular response to transforming growth factor beta stimulus",1.36275918251451e-09,2.35905004552252e-09
"1515","GO:0071695","developmental maturation","Down, Up","anatomical structure maturation",1.64322532138465e-14,1.14842614496129e-10
"1516","GO:0071702","organic substance transport","Down, Up","organic substance transport",3.62981709885046e-103,1.13278278683816e-107
"1517","GO:0071704","metabolic process","Down, Up","organic substance metabolic process",0,0
"1518","GO:0071705","nitrogen compound transport","Down, Up","nitrogen compound transport",2.3610272353776e-92,4.72047306477518e-99
"1519","GO:0071774","response to endogenous stimulus","Down, Up","response to fibroblast growth factor",3.50200870616376e-09,6.94411349254526e-06
"1520","GO:0071824","protein-containing complex organization","Down, Up","protein-DNA complex subunit organization",8.9792822098002e-17,4.26195856389544e-14
"1521","GO:0071826","protein-containing complex organization","Down, Up","ribonucleoprotein complex subunit organization",2.05020281038175e-22,9.78573990878014e-32
"1522","GO:0071840","cellular component organization or biogenesis","Down, Up","cellular component organization or biogenesis",0,0
