"","X","GOterm","over_represented_pvalue","under_represented_pvalue","numDEInCat","numInCat","term","ontology","bh_adjust","ParentTerm","Factor"
"377",463,"GO:0010558",9.7547273693653e-43,1,36,36,"negative regulation of macromolecule biosynthetic process","BP",1.08922594747386e-41,"negative regulation of biological process","Up"
"378",464,"GO:2000113",9.7547273693653e-43,1,36,36,"negative regulation of cellular macromolecule biosynthetic process","BP",1.08922594747386e-41,"regulation of DNA metabolic process","Up"
"379",465,"GO:0032880",1.28497832199695e-42,1,36,36,"regulation of protein localization","BP",1.43253564126932e-41,"regulation of endocytosis","Up"
"380",466,"GO:0043085",4.08199827926347e-42,1,35,35,"positive regulation of catalytic activity","BP",4.5434980847216e-41,"regulation of protein binding","Up"
"381",467,"GO:0042325",5.7857748702874e-42,1,35,35,"regulation of phosphorylation","BP",6.42966078589967e-41,"purine ribonucleotide metabolic process","Up"
"382",468,"GO:0006508",7.53520802163176e-42,1,35,35,"proteolysis","BP",8.36049270971524e-41,"protein maturation","Up"
"383",469,"GO:0045184",7.68780154482064e-42,1,35,35,"establishment of protein localization","BP",8.51628095060162e-41,"mitochondrial transport","Up"
"384",470,"GO:0009791",9.15572596612452e-42,1,35,35,"post-embryonic development","BP",1.01103514223081e-40,"nematode larval development","Up"
"385",471,"GO:0071310",1.03546763586149e-41,1,35,35,"cellular response to organic substance","BP",1.14162756698294e-40,"response to toxic substance","Up"
"386",472,"GO:0071705",1.11747768791307e-41,1,35,35,"nitrogen compound transport","BP",1.23010536039565e-40,"nitrogen compound transport","Up"
"387",473,"GO:1901700",1.2895335797544e-41,1,35,35,"response to oxygen-containing compound","BP",1.41727039661686e-40,"response to toxic substance","Up"
"388",474,"GO:0018130",1.31148819415057e-41,1,35,35,"heterocycle biosynthetic process","BP",1.43463262552621e-40,"biosynthetic process","Up"
"389",475,"GO:0019438",1.31148819415057e-41,1,35,35,"aromatic compound biosynthetic process","BP",1.43463262552621e-40,"biosynthetic process","Up"
"390",476,"GO:0034654",1.31148819415057e-41,1,35,35,"nucleobase-containing compound biosynthetic process","BP",1.43463262552621e-40,"biosynthetic process","Up"
"391",477,"GO:0000278",8.3051910358903e-41,1,34,34,"mitotic cell cycle","BP",9.05667478016743e-40,"positive regulation of cell cycle","Up"
"392",478,"GO:0048729",9.29994338177925e-41,1,34,34,"tissue morphogenesis","BP",1.01256392895073e-39,"epithelial cell development","Up"
"393",479,"GO:0016477",1.02767120585764e-40,1,34,34,"cell migration","BP",1.11717289719205e-39,"regulation of cell motility","Up"
"394",480,"GO:0032989",1.74420014123595e-40,1,34,34,"cellular component morphogenesis","BP",1.88438315104162e-39,"post-embryonic animal organ morphogenesis","Up"
"395",481,"GO:0044087",1.78997716954879e-40,1,34,34,"regulation of cellular component biogenesis","BP",1.93085500233735e-39,"vesicle organization","Up"
"396",482,"GO:0051248",1.9770476559371e-40,1,34,34,"negative regulation of protein metabolic process","BP",2.12608663307697e-39,"negative regulation of biological process","Up"
"397",483,"GO:0048666",2.04767486497239e-40,1,34,34,"neuron development","BP",2.19865550017773e-39,"vasculature development","Up"
"398",484,"GO:0060284",2.10140153781729e-40,1,34,34,"regulation of cell development","BP",2.25288293701577e-39,"positive regulation of neuron differentiation","Up"
"399",485,"GO:0051129",2.33618765892717e-40,1,34,34,"negative regulation of cellular component organization","BP",2.50075830565099e-39,"positive regulation of chromosome organization","Up"
"400",486,"GO:0009792",1.8454859040354e-39,1,33,33,"embryo development ending in birth or egg hatching","BP",1.96945747621488e-38,"nematode larval development","Up"
"401",487,"GO:0006259",1.94086295192007e-39,1,33,33,"DNA metabolic process","BP",2.0680841515124e-38,"regulation of DNA metabolic process","Up"
"402",488,"GO:0031401",2.2088615412339e-39,1,33,33,"positive regulation of protein modification process","BP",2.35006730186073e-38,"post-transcriptional regulation of gene expression","Up"
"403",489,"GO:0015833",2.44782335890404e-39,1,33,33,"peptide transport","BP",2.59246746647565e-38,"nitrogen compound transport","Up"
"404",490,"GO:0042886",2.44782335890404e-39,1,33,33,"amide transport","BP",2.59246746647565e-38,"nitrogen compound transport","Up"
"405",491,"GO:0080134",3.4802920565162e-39,1,33,33,"regulation of response to stress","BP",3.66374118600124e-38,"regulation of response to external stimulus","Up"
"406",492,"GO:0019637",1.56040456512192e-38,1,32,32,"organophosphate metabolic process","BP",1.63772190843877e-37,"purine ribonucleotide metabolic process","Up"
"407",493,"GO:0002009",2.23868020540306e-38,1,32,32,"morphogenesis of an epithelium","BP",2.34608315378821e-37,"epithelial cell development","Up"
"408",494,"GO:1901566",2.81046087851855e-38,1,32,32,"organonitrogen compound biosynthetic process","BP",2.93649051432655e-37,"biosynthetic process","Up"
"409",495,"GO:0008283",3.21895047682143e-38,1,32,32,"cell population proliferation","BP",3.35827818402713e-37,"negative regulation of cell population proliferation","Up"
"410",496,"GO:0015031",3.61394606026032e-38,1,32,32,"protein transport","BP",3.76475155904913e-37,"mitochondrial transport","Up"
"411",497,"GO:0007281",3.7525786522529e-38,1,32,32,"germ cell development","BP",3.90335190167377e-37,"development of primary sexual characteristics","Up"
"412",498,"GO:0070925",4.22094639854424e-38,1,32,32,"organelle assembly","BP",4.38401416431266e-37,"vesicle organization","Up"
"413",499,"GO:0016310",4.43313605391673e-38,1,32,32,"phosphorylation","BP",4.59756988380978e-37,"purine ribonucleotide metabolic process","Up"
"414",500,"GO:0060341",4.44451713222983e-38,1,32,32,"regulation of cellular localization","BP",4.60254440804245e-37,"regulation of endocytosis","Up"
"415",501,"GO:0060548",2.36892036132637e-37,1,31,31,"negative regulation of cell death","BP",2.44590152520994e-36,"apoptotic signaling pathway","Up"
"416",502,"GO:0001932",3.64825171943864e-37,1,31,31,"regulation of protein phosphorylation","BP",3.7612506665009e-36,"post-transcriptional regulation of gene expression","Up"
"417",503,"GO:0035239",4.04116934316906e-37,1,31,31,"tube morphogenesis","BP",4.16020231351278e-36,"nematode larval development","Up"
"418",504,"GO:0006082",5.03168563113361e-37,1,31,31,"organic acid metabolic process","BP",5.16468172711071e-36,"regulation of small molecule metabolic process","Up"
"419",505,"GO:0043436",5.03168563113361e-37,1,31,31,"oxoacid metabolic process","BP",5.16468172711071e-36,"regulation of small molecule metabolic process","Up"
"420",506,"GO:0009719",5.0670721931749e-37,1,31,31,"response to endogenous stimulus","BP",5.1933775117731e-36,"response to endogenous stimulus","Up"
"421",507,"GO:0007417",5.51269281243716e-37,1,31,31,"central nervous system development","BP",5.6418334932556e-36,"vasculature development","Up"
"422",508,"GO:0007010",7.26835438309528e-37,1,31,31,"cytoskeleton organization","BP",7.4169046916549e-36,"vesicle organization","Up"
"423",509,"GO:0044092",7.53149370796252e-37,1,31,31,"negative regulation of molecular function","BP",7.67421880738454e-36,"regulation of protein binding","Up"
"424",510,"GO:0051253",8.81405646557746e-37,1,31,31,"negative regulation of RNA metabolic process","BP",8.96801378375349e-36,"negative regulation of biological process","Up"
"425",511,"GO:0048646",5.70895587766075e-36,1,30,30,"anatomical structure formation involved in morphogenesis","BP",5.78342051954328e-35,"post-embryonic animal organ morphogenesis","Up"
"426",512,"GO:0003008",5.92579075816723e-36,1,30,30,"system process","BP",5.99439615044703e-35,"cognition","Up"
"427",513,"GO:0006955",7.52037056634253e-36,1,30,30,"immune response","BP",7.58548199981736e-35,"regulation of immune response","Up"
"428",514,"GO:0006396",7.96787471821077e-36,1,30,30,"RNA processing","BP",8.02528015566186e-35,"protein maturation","Up"
"429",515,"GO:0007017",8.69230495580487e-36,1,30,30,"microtubule-based process","BP",8.74233261022677e-35,"microtubule-based movement","Up"
"430",516,"GO:0050767",9.9582382948442e-36,1,30,30,"regulation of neurogenesis","BP",1.00011617357703e-34,"negative regulation of neurogenesis","Up"
"431",517,"GO:0045892",1.2974481510428e-35,1,30,30,"negative regulation of DNA-templated transcription","BP",1.29559465368416e-34,"negative regulation of biological process","Up"
"432",518,"GO:1902679",1.2974481510428e-35,1,30,30,"negative regulation of RNA biosynthetic process","BP",1.29559465368416e-34,"negative regulation of biological process","Up"
"433",519,"GO:1903507",1.2974481510428e-35,1,30,30,"negative regulation of nucleic acid-templated transcription","BP",1.29559465368416e-34,"negative regulation of biological process","Up"
"434",520,"GO:0048232",1.70816733783124e-35,1,30,30,"male gamete generation","BP",1.70329382188879e-34,"development of primary sexual characteristics","Up"
"435",521,"GO:0010564",6.7581198496347e-35,1,29,29,"regulation of cell cycle process","BP",6.72923899557643e-34,"positive regulation of cell cycle","Up"
"436",522,"GO:0006629",7.08627487545948e-35,1,29,29,"lipid metabolic process","BP",7.03594621867354e-34,"glycerolipid metabolic process","Up"
"437",523,"GO:0051338",8.99138561830307e-35,1,29,29,"regulation of transferase activity","BP",8.914863187509e-34,"regulation of protein binding","Up"
"438",524,"GO:0009894",1.04964461256031e-34,1,29,29,"regulation of catabolic process","BP",1.03923737135929e-33,"positive regulation of catabolic process","Up"
"439",525,"GO:0019752",1.10071082147907e-34,1,29,29,"carboxylic acid metabolic process","BP",1.08825581925583e-33,"regulation of small molecule metabolic process","Up"
"440",526,"GO:0060322",1.19188376169368e-34,1,29,29,"head development","BP",1.17673269692639e-33,"head development","Up"
"441",527,"GO:0006974",1.67755173297163e-34,1,29,29,"cellular response to DNA damage stimulus","BP",1.64923862355439e-33,"double-strand break repair","Up"
"442",528,"GO:0007610",1.83875547982149e-34,1,29,29,"behavior","BP",1.8051826971843e-33,"locomotory behavior","Up"
"443",529,"GO:0044255",1.03865913802775e-33,1,28,28,"cellular lipid metabolic process","BP",1.0154164160579e-32,"glycerolipid metabolic process","Up"
"444",530,"GO:0035556",1.05266926911093e-33,1,28,28,"intracellular signal transduction","BP",1.02767572501193e-32,"transmembrane receptor protein tyrosine kinase signaling pathway","Up"
"445",531,"GO:0046903",1.31972197802728e-33,1,28,28,"secretion","BP",1.28659088234458e-32,"regulation of secretion by cell","Up"
"446",532,"GO:0002682",1.69379309916308e-33,1,28,28,"regulation of immune system process","BP",1.64897127620473e-32,"regulation of immune response","Up"
"447",533,"GO:0031344",1.91906891244801e-33,1,28,28,"regulation of cell projection organization","BP",1.86309606916828e-32,"regulation of dendrite development","Up"
"448",534,"GO:0120035",1.91906891244801e-33,1,28,28,"regulation of plasma membrane bounded cell projection organization","BP",1.86309606916828e-32,"regulation of dendrite development","Up"
"449",535,"GO:0033365",2.08352814882697e-33,1,28,28,"protein localization to organelle","BP",2.01995308742032e-32,"mitochondrial transport","Up"
"450",536,"GO:0048285",2.2766559479485e-33,1,28,28,"organelle fission","BP",2.20413089697507e-32,"positive regulation of chromosome organization","Up"
"451",537,"GO:0051640",2.44340859785342e-33,1,28,28,"organelle localization","BP",2.36229959875456e-32,"vesicle localization","Up"
"452",538,"GO:0030162",1.51395175291214e-32,1,27,27,"regulation of proteolysis","BP",1.45965831073874e-31,"post-transcriptional regulation of gene expression","Up"
"453",539,"GO:0043066",1.65220952125689e-32,1,27,27,"negative regulation of apoptotic process","BP",1.58857559196501e-31,"apoptotic signaling pathway","Up"
"454",540,"GO:0043069",1.65220952125689e-32,1,27,27,"negative regulation of programmed cell death","BP",1.58857559196501e-31,"apoptotic signaling pathway","Up"
"455",541,"GO:1902533",2.37331880234301e-32,1,27,27,"positive regulation of intracellular signal transduction","BP",2.27877725664528e-31,"transmembrane receptor protein tyrosine kinase signaling pathway","Up"
"456",542,"GO:0051050",2.5100673310458e-32,1,27,27,"positive regulation of transport","BP",2.40677237915091e-31,"regulation of endocytosis","Up"
"457",543,"GO:0007420",2.56011097528826e-32,1,27,27,"brain development","BP",2.45139393387191e-31,"head development","Up"
"458",544,"GO:1903047",2.6643373698919e-32,1,27,27,"mitotic cell cycle process","BP",2.54770427025231e-31,"positive regulation of cell cycle","Up"
"459",545,"GO:0000902",2.89982442354916e-32,1,27,27,"cell morphogenesis","BP",2.76909463396293e-31,"post-embryonic animal organ morphogenesis","Up"
"460",546,"GO:0010638",3.01102029558524e-32,1,27,27,"positive regulation of organelle organization","BP",2.87135496127432e-31,"positive regulation of chromosome organization","Up"
"461",547,"GO:0045944",4.6711487983736e-32,1,27,27,"positive regulation of transcription by RNA polymerase II","BP",4.44235783682061e-31,"positive regulation of biological process","Up"
"462",548,"GO:1901135",1.30214696828988e-31,1,26,26,"carbohydrate derivative metabolic process","BP",1.23668577559052e-30,"carbohydrate derivative metabolic process","Up"
"463",549,"GO:0007423",2.24767741394476e-31,1,26,26,"sensory organ development","BP",2.13178631254734e-30,"gland development","Up"
"464",550,"GO:0007389",2.46017489187471e-31,1,26,26,"pattern specification process","BP",2.32386790462219e-30,"nematode larval development","Up"
"465",551,"GO:0009057",2.70552444393603e-31,1,26,26,"macromolecule catabolic process","BP",2.55217488031213e-30,"positive regulation of catabolic process","Up"
"466",552,"GO:0018193",2.81280150787367e-31,1,26,26,"peptidyl-amino acid modification","BP",2.64979549057102e-30,"protein autophosphorylation","Up"
"467",553,"GO:0031329",3.29465762149068e-31,1,26,26,"regulation of cellular catabolic process","BP",3.09538397502955e-30,"positive regulation of catabolic process","Up"
"468",554,"GO:0007292",3.77443631253234e-31,1,26,26,"female gamete generation","BP",3.54138386907397e-30,"development of primary sexual characteristics","Up"
"469",555,"GO:0045664",4.60184671417313e-31,1,26,26,"regulation of neuron differentiation","BP",4.27751443245614e-30,"positive regulation of neuron differentiation","Up"
"470",556,"GO:0022603",4.6240636825556e-31,1,26,26,"regulation of anatomical structure morphogenesis","BP",4.29245752205361e-30,"post-embryonic animal organ morphogenesis","Up"
"471",557,"GO:0000280",4.91471820414597e-31,1,26,26,"nuclear division","BP",4.55621753938731e-30,"positive regulation of chromosome organization","Up"
"472",558,"GO:0061024",5.41261232561546e-31,1,26,26,"membrane organization","BP",5.0111470405367e-30,"vesicle organization","Up"
"473",559,"GO:0032940",4.12823888388045e-30,1,25,25,"secretion by cell","BP",3.80691158289239e-29,"regulation of secretion by cell","Up"
"474",560,"GO:1901565",4.37942796300207e-30,1,25,25,"organonitrogen compound catabolic process","BP",4.02792124491901e-29,"positive regulation of catabolic process","Up"
"475",561,"GO:0045596",4.47357782353379e-30,1,25,25,"negative regulation of cell differentiation","BP",4.10910761977676e-29,"positive regulation of neuron differentiation","Up"
"476",562,"GO:0048878",4.65372379154641e-30,1,25,25,"chemical homeostasis","BP",4.26896710011934e-29,"calcium ion homeostasis","Up"
"477",563,"GO:0071495",5.03725159405187e-30,1,25,25,"cellular response to endogenous stimulus","BP",4.61472983517989e-29,"response to endogenous stimulus","Up"
"478",564,"GO:0001775",5.71324351276711e-30,1,25,25,"cell activation","BP",5.19994429091694e-29,"lymphocyte activation","Up"
"479",565,"GO:0045321",5.71324351276711e-30,1,25,25,"leukocyte activation","BP",5.19994429091694e-29,"lymphocyte activation","Up"
"480",566,"GO:0006886",7.14216991996628e-30,1,25,25,"intracellular protein transport","BP",6.49203741749861e-29,"mitochondrial transport","Up"
"481",567,"GO:0043603",7.44473562261907e-30,1,25,25,"amide metabolic process","BP",6.75827298728666e-29,"regulation of amide metabolic process","Up"
"482",568,"GO:0031400",8.10397150623223e-30,1,25,25,"negative regulation of protein modification process","BP",7.34718039280977e-29,"post-transcriptional regulation of gene expression","Up"
"483",569,"GO:0070201",9.71590130280457e-30,1,25,25,"regulation of establishment of protein localization","BP",8.78578914703803e-29,"regulation of endocytosis","Up"
"484",570,"GO:0051345",3.35997840180479e-29,1,24,24,"positive regulation of hydrolase activity","BP",3.03439909930432e-28,"regulation of protein binding","Up"
"485",571,"GO:0055086",5.58710077999695e-29,1,24,24,"nucleobase-containing small molecule metabolic process","BP",5.03271062528075e-28,"regulation of small molecule metabolic process","Up"
"486",572,"GO:0045597",7.17306318909916e-29,1,24,24,"positive regulation of cell differentiation","BP",6.45298734772241e-28,"positive regulation of neuron differentiation","Up"
"487",573,"GO:0007267",7.19974208182453e-29,1,24,24,"cell-cell signaling","BP",6.46866287300173e-28,"trans-synaptic signaling","Up"
"488",574,"GO:0032990",9.62325086859174e-29,1,24,24,"cell part morphogenesis","BP",8.6128711359099e-28,"post-embryonic animal organ morphogenesis","Up"
"489",575,"GO:0031175",9.69879782086912e-29,1,24,24,"neuron projection development","BP",8.66938577594311e-28,"vasculature development","Up"
"490",576,"GO:0007346",9.80120625865692e-29,1,24,24,"regulation of mitotic cell cycle","BP",8.74973585542936e-28,"positive regulation of cell cycle","Up"
"491",577,"GO:0008219",1.04676638110135e-28,1,24,24,"cell death","BP",9.33277679068681e-28,"apoptotic signaling pathway","Up"
"492",579,"GO:0043086",1.09150341796578e-28,1,24,24,"negative regulation of catalytic activity","BP",9.70688154145141e-28,"regulation of protein binding","Up"
"493",580,"GO:0009314",1.49182972133483e-28,1,24,24,"response to radiation","BP",1.32165903068827e-27,"response to temperature stimulus","Up"
"494",581,"GO:0010942",8.6045841452729e-28,1,23,23,"positive regulation of cell death","BP",7.58462082918759e-27,"apoptotic signaling pathway","Up"
"495",582,"GO:0044265",8.95989918498832e-28,1,23,23,"cellular macromolecule catabolic process","BP",7.88787094497083e-27,"positive regulation of catabolic process","Up"
"496",583,"GO:0060562",9.13896154599052e-28,1,23,23,"epithelial tube morphogenesis","BP",8.03538883100299e-27,"nematode larval development","Up"
"497",584,"GO:0048569",1.006206929537e-27,1,23,23,"post-embryonic animal organ development","BP",8.83591260987895e-27,"gland development","Up"
"498",585,"GO:0043549",1.01357674282843e-27,1,23,23,"regulation of kinase activity","BP",8.88946227399089e-27,"regulation of protein binding","Up"
"499",586,"GO:0040012",1.15981044971401e-27,1,23,23,"regulation of locomotion","BP",1.01592419091491e-26,"positive regulation of locomotion","Up"
"500",587,"GO:1902532",1.20912569175898e-27,1,23,23,"negative regulation of intracellular signal transduction","BP",1.05779581794685e-26,"trans-synaptic signaling","Up"
"501",588,"GO:0000904",1.31804916228593e-27,1,23,23,"cell morphogenesis involved in differentiation","BP",1.15164545554734e-26,"post-embryonic animal organ morphogenesis","Up"
"502",589,"GO:0012501",1.52337208724439e-27,1,23,23,"programmed cell death","BP",1.32938463044174e-26,"apoptotic signaling pathway","Up"
"503",591,"GO:0051321",1.58051202376204e-27,1,23,23,"meiotic cell cycle","BP",1.37410187140505e-26,"positive regulation of cell cycle","Up"
"504",592,"GO:1903046",1.58051202376204e-27,1,23,23,"meiotic cell cycle process","BP",1.37410187140505e-26,"positive regulation of cell cycle","Up"
"505",593,"GO:0051223",2.06196669424177e-27,1,23,23,"regulation of protein transport","BP",1.78823166163151e-26,"regulation of endocytosis","Up"
"506",594,"GO:0090087",2.06196669424177e-27,1,23,23,"regulation of peptide transport","BP",1.78823166163151e-26,"nitrogen compound transport","Up"
"507",595,"GO:0000122",2.21911553476664e-27,1,23,23,"negative regulation of transcription by RNA polymerase II","BP",1.92213353011385e-26,"negative regulation of biological process","Up"
"508",596,"GO:0007005",1.09181534465925e-26,1,22,22,"mitochondrion organization","BP",9.44528373659425e-26,"vesicle organization","Up"
"509",597,"GO:0045859",1.47173417262666e-26,1,22,22,"regulation of protein kinase activity","BP",1.27162198599016e-25,"post-transcriptional regulation of gene expression","Up"
"510",598,"GO:0002252",1.67853599249698e-26,1,22,22,"immune effector process","BP",1.44672830919284e-25,"regulation of immune response","Up"
"511",599,"GO:0051301",1.70334587818913e-26,1,22,22,"cell division","BP",1.4663039025298e-25,"cell division","Up"
"512",600,"GO:0006468",1.9974792475276e-26,1,22,22,"protein phosphorylation","BP",1.71738990654587e-25,"purine ribonucleotide metabolic process","Up"
"513",601,"GO:0048667",2.05045537489321e-26,1,22,22,"cell morphogenesis involved in neuron differentiation","BP",1.75430637337865e-25,"post-embryonic animal organ morphogenesis","Up"
"514",602,"GO:0048812",2.05045537489321e-26,1,22,22,"neuron projection morphogenesis","BP",1.75430637337865e-25,"post-embryonic animal organ morphogenesis","Up"
"515",603,"GO:0048858",2.05045537489321e-26,1,22,22,"cell projection morphogenesis","BP",1.75430637337865e-25,"post-embryonic animal organ morphogenesis","Up"
"516",604,"GO:0120039",2.05045537489321e-26,1,22,22,"plasma membrane bounded cell projection morphogenesis","BP",1.75430637337865e-25,"post-embryonic animal organ morphogenesis","Up"
"517",605,"GO:0010975",2.07032537900584e-26,1,22,22,"regulation of neuron projection development","BP",1.76914112460279e-25,"regulation of dendrite development","Up"
"518",606,"GO:0006811",2.19822787287381e-26,1,22,22,"monoatomic ion transport","BP",1.87614320285567e-25,"mitochondrial transport","Up"
"519",607,"GO:0051656",2.39594206835442e-26,1,22,22,"establishment of organelle localization","BP",2.03990682798994e-25,"vesicle localization","Up"
"520",608,"GO:0006325",2.55491062864966e-26,1,22,22,"chromatin organization","BP",2.17260648348675e-25,"regulation of chromatin organization","Up"
"521",609,"GO:0070647",1.79193408936495e-25,1,21,21,"protein modification by small protein conjugation or removal","BP",1.52009942775012e-24,"protein autophosphorylation","Up"
"522",610,"GO:0043065",1.809714121798e-25,1,21,21,"positive regulation of apoptotic process","BP",1.53146509822857e-24,"apoptotic signaling pathway","Up"
"523",611,"GO:0043068",1.809714121798e-25,1,21,21,"positive regulation of programmed cell death","BP",1.53146509822857e-24,"apoptotic signaling pathway","Up"
"524",612,"GO:0048598",2.30854567833891e-25,1,21,21,"embryonic morphogenesis","BP",1.95123752014377e-24,"nematode larval development","Up"
"525",613,"GO:0034660",2.73501698154607e-25,1,21,21,"ncRNA metabolic process","BP",2.30612408938565e-24,"nucleic acid phosphodiester bond hydrolysis","Up"
"526",614,"GO:0051962",2.83967871953407e-25,1,21,21,"positive regulation of nervous system development","BP",2.39148846380038e-24,"negative regulation of neurogenesis","Up"
"527",615,"GO:0090066",2.93778363922461e-25,1,21,21,"regulation of anatomical structure size","BP",2.47113208642359e-24,"regulation of hormone levels","Up"
"528",616,"GO:0022411",3.03700601644032e-25,1,21,21,"cellular component disassembly","BP",2.55152308352378e-24,"vesicle organization","Up"
"529",617,"GO:0006915",3.21077467790928e-25,1,21,21,"apoptotic process","BP",2.69427551003432e-24,"apoptotic signaling pathway","Up"
"530",618,"GO:0003002",3.23890215484184e-25,1,21,21,"regionalization","BP",2.71461943193578e-24,"nematode larval development","Up"
"531",619,"GO:0006952",3.44788184771804e-25,1,21,21,"defense response","BP",2.88631067252085e-24,"double-strand break repair","Up"
"532",620,"GO:1901701",3.4889679474903e-25,1,21,21,"cellular response to oxygen-containing compound","BP",2.91721123839201e-24,"response to toxic substance","Up"
"533",621,"GO:0040008",3.55035865690739e-25,1,21,21,"regulation of growth","BP",2.96499486401226e-24,"positive regulation of growth","Up"
"534",622,"GO:0030097",3.58266708530976e-25,1,21,21,"hemopoiesis","BP",2.98430496370447e-24,"cell fate commitment","Up"
"535",623,"GO:0010243",3.58628922676932e-25,1,21,21,"response to organonitrogen compound","BP",2.98430496370447e-24,"response to toxic substance","Up"
"536",624,"GO:1901698",3.58628922676932e-25,1,21,21,"response to nitrogen compound","BP",2.98430496370447e-24,"response to toxic substance","Up"
"537",625,"GO:0055085",3.80312421130242e-25,1,21,21,"transmembrane transport","BP",3.15722544382469e-24,"mitochondrial transport","Up"
"538",626,"GO:0000226",3.80938426376304e-25,1,21,21,"microtubule cytoskeleton organization","BP",3.15867093756864e-24,"microtubule-based movement","Up"
"539",627,"GO:0016071",3.86452636815096e-25,1,21,21,"mRNA metabolic process","BP",3.20059707504446e-24,"nucleic acid phosphodiester bond hydrolysis","Up"
"540",628,"GO:0007059",4.79353163060643e-25,1,21,21,"chromosome segregation","BP",3.96061301394078e-24,"positive regulation of cell cycle","Up"
"541",629,"GO:0009991",5.26435863311446e-25,1,21,21,"response to extracellular stimulus","BP",4.3393710902677e-24,"response to nutrient","Up"
"542",630,"GO:0031667",5.26435863311446e-25,1,21,21,"response to nutrient levels","BP",4.3393710902677e-24,"response to nutrient","Up"
"543",631,"GO:0080135",5.34844777616817e-25,1,21,21,"regulation of cellular response to stress","BP",4.40349233868263e-24,"regulation of response to external stimulus","Up"
"544",632,"GO:0007283",5.52137974607525e-25,1,21,21,"spermatogenesis","BP",4.54052287353717e-24,"development of primary sexual characteristics","Up"
"545",633,"GO:0006753",2.4698448097834e-24,1,20,20,"nucleoside phosphate metabolic process","BP",2.02394082302297e-23,"regulation of small molecule metabolic process","Up"
