"","X","GOterm","over_represented_pvalue","under_represented_pvalue","numDEInCat","numInCat","term","ontology","bh_adjust","ParentTerm","Factor"
"546",634,"GO:0009117",2.4698448097834e-24,1,20,20,"nucleotide metabolic process","BP",2.02394082302297e-23,"regulation of small molecule metabolic process","Up"
"547",635,"GO:0010562",2.94050180363171e-24,1,20,20,"positive regulation of phosphorus metabolic process","BP",2.40398919384627e-23,"purine ribonucleotide metabolic process","Up"
"548",636,"GO:0045937",2.94050180363171e-24,1,20,20,"positive regulation of phosphate metabolic process","BP",2.40398919384627e-23,"purine ribonucleotide metabolic process","Up"
"549",637,"GO:0001654",3.72457069064815e-24,1,20,20,"eye development","BP",3.03435304517839e-23,"gland development","Up"
"550",638,"GO:0032787",4.23060282920114e-24,1,20,20,"monocarboxylic acid metabolic process","BP",3.4406236590061e-23,"regulation of small molecule metabolic process","Up"
"551",639,"GO:0033993",4.48845087598846e-24,1,20,20,"response to lipid","BP",3.64393398642966e-23,"response to toxic substance","Up"
"552",640,"GO:0042330",4.64517214452424e-24,1,20,20,"taxis","BP",3.76679272508404e-23,"response to nutrient","Up"
"553",641,"GO:0006281",4.98707676499755e-24,1,20,20,"DNA repair","BP",4.0253656567359e-23,"double-strand break repair","Up"
"554",642,"GO:0014070",5.18981964734124e-24,1,20,20,"response to organic cyclic compound","BP",4.18417985408481e-23,"response to toxic substance","Up"
"555",643,"GO:0072359",5.86259903150018e-24,1,20,20,"circulatory system development","BP",4.72114829840855e-23,"vasculature development","Up"
"556",644,"GO:0052547",4.06065928760147e-23,1,19,19,"regulation of peptidase activity","BP",3.25131826120668e-22,"post-transcriptional regulation of gene expression","Up"
"557",645,"GO:0042327",4.24732684182674e-23,1,19,19,"positive regulation of phosphorylation","BP",3.3968895451223e-22,"purine ribonucleotide metabolic process","Up"
"558",646,"GO:0071900",4.45988799798851e-23,1,19,19,"regulation of protein serine/threonine kinase activity","BP",3.56281338353596e-22,"regulation of protein binding","Up"
"559",647,"GO:0050801",4.6534972755381e-23,1,19,19,"monoatomic ion homeostasis","BP",3.71323583972732e-22,"calcium ion homeostasis","Up"
"560",648,"GO:0019725",4.66405152684869e-23,1,19,19,"cellular homeostasis","BP",3.71741393074941e-22,"calcium ion homeostasis","Up"
"561",650,"GO:0048477",5.55134931895232e-23,1,19,19,"oogenesis","BP",4.41455423657301e-22,"development of primary sexual characteristics","Up"
"562",651,"GO:0031346",5.60778318476008e-23,1,19,19,"positive regulation of cell projection organization","BP",4.4543641433492e-22,"regulation of dendrite development","Up"
"563",652,"GO:0006979",5.6334388157479e-23,1,19,19,"response to oxidative stress","BP",4.46966371419725e-22,"double-strand break repair","Up"
"564",653,"GO:0045786",5.91176316171771e-23,1,19,19,"negative regulation of cell cycle","BP",4.68517284585111e-22,"positive regulation of cell cycle","Up"
"565",654,"GO:0044089",6.33235261416244e-23,1,19,19,"positive regulation of cellular component biogenesis","BP",5.01281367757593e-22,"vesicle organization","Up"
"566",655,"GO:0061061",6.41802317077505e-23,1,19,19,"muscle structure development","BP",5.07488483752461e-22,"muscle organ development","Up"
"567",656,"GO:0006935",6.71646639549294e-23,1,19,19,"chemotaxis","BP",5.29290869272781e-22,"response to nutrient","Up"
"568",657,"GO:0007409",6.71646639549294e-23,1,19,19,"axonogenesis","BP",5.29290869272781e-22,"post-embryonic animal organ morphogenesis","Up"
"569",658,"GO:0061564",6.71646639549294e-23,1,19,19,"axon development","BP",5.29290869272781e-22,"vasculature development","Up"
"570",659,"GO:0060627",7.55207428483184e-23,1,19,19,"regulation of vesicle-mediated transport","BP",5.93134823044658e-22,"regulation of endocytosis","Up"
"571",660,"GO:0098657",7.56473192851893e-23,1,19,19,"import into cell","BP",5.93462134459566e-22,"import into cell","Up"
"572",661,"GO:0009607",7.5956917635347e-23,1,19,19,"response to biotic stimulus","BP",5.9522293079717e-22,"response to bacterium","Up"
"573",662,"GO:0050877",9.26962317759778e-23,1,19,19,"nervous system process","BP",7.22348562000094e-22,"cognition","Up"
"574",663,"GO:0006351",1.00786291074992e-22,1,19,19,"DNA-templated transcription","BP",7.81904744299885e-22,"biosynthetic process","Up"
"575",664,"GO:0032774",1.00786291074992e-22,1,19,19,"RNA biosynthetic process","BP",7.81904744299885e-22,"biosynthetic process","Up"
"576",665,"GO:0097659",1.00786291074992e-22,1,19,19,"nucleic acid-templated transcription","BP",7.81904744299885e-22,"biosynthetic process","Up"
"577",666,"GO:0140013",1.04770542776879e-22,1,19,19,"meiotic nuclear division","BP",8.11913629723266e-22,"positive regulation of cell cycle","Up"
"578",667,"GO:0033044",1.105880514975e-22,1,19,19,"regulation of chromosome organization","BP",8.56047043153404e-22,"positive regulation of chromosome organization","Up"
"579",668,"GO:0045862",5.86812585034701e-22,1,18,18,"positive regulation of proteolysis","BP",4.53239775623488e-21,"post-transcriptional regulation of gene expression","Up"
"580",669,"GO:0098771",6.71172671082723e-22,1,18,18,"inorganic ion homeostasis","BP",5.17825272722763e-21,"calcium ion homeostasis","Up"
"581",670,"GO:0034097",7.69317360939868e-22,1,18,18,"response to cytokine","BP",5.92278059715145e-21,"response to toxic substance","Up"
"582",673,"GO:0006887",7.97192598513727e-22,1,18,18,"exocytosis","BP",6.11676867575296e-21,"regulation of secretion by cell","Up"
"583",674,"GO:0045055",7.97192598513727e-22,1,18,18,"regulated exocytosis","BP",6.11676867575296e-21,"regulation of secretion by cell","Up"
"584",675,"GO:0001934",8.13343766006799e-22,1,18,18,"positive regulation of protein phosphorylation","BP",6.22702401356794e-21,"post-transcriptional regulation of gene expression","Up"
"585",676,"GO:0034470",8.37405690637093e-22,1,18,18,"ncRNA processing","BP",6.40422951592263e-21,"nucleic acid phosphodiester bond hydrolysis","Up"
"586",677,"GO:0010720",9.07445975040249e-22,1,18,18,"positive regulation of cell development","BP",6.93229220276649e-21,"positive regulation of neuron differentiation","Up"
"587",678,"GO:0006812",9.67174133096202e-22,1,18,18,"monoatomic cation transport","BP",7.38051003312495e-21,"mitochondrial transport","Up"
"588",679,"GO:0008284",9.9427322541493e-22,1,18,18,"positive regulation of cell population proliferation","BP",7.57902927551838e-21,"negative regulation of cell population proliferation","Up"
"589",680,"GO:0051961",1.07753647870861e-21,1,18,18,"negative regulation of nervous system development","BP",8.17804558759304e-21,"negative regulation of neurogenesis","Up"
"590",681,"GO:0006897",1.09220728495873e-21,1,18,18,"endocytosis","BP",8.28040013217084e-21,"vesicle-mediated transport in synapse","Up"
"591",682,"GO:0043408",1.16368124467439e-21,1,18,18,"regulation of MAPK cascade","BP",8.75579321880948e-21,"transmembrane receptor protein tyrosine kinase signaling pathway","Up"
"592",683,"GO:0009725",1.20716493735112e-21,1,18,18,"response to hormone","BP",9.06346177452666e-21,"response to endogenous stimulus","Up"
"593",684,"GO:0034220",1.43368449090056e-21,1,18,18,"monoatomic ion transmembrane transport","BP",1.07526336817542e-20,"mitochondrial transport","Up"
"594",685,"GO:0006366",1.45554937138651e-21,1,18,18,"transcription by RNA polymerase II","BP",1.0904919727751e-20,"biosynthetic process","Up"
"595",686,"GO:0048608",1.64398787651454e-21,1,18,18,"reproductive structure development","BP",1.22903478682745e-20,"vasculature development","Up"
"596",687,"GO:0061458",1.64398787651454e-21,1,18,18,"reproductive system development","BP",1.22903478682745e-20,"vasculature development","Up"
"597",688,"GO:0010639",1.74530726436533e-21,1,18,18,"negative regulation of organelle organization","BP",1.30199549390754e-20,"positive regulation of chromosome organization","Up"
"598",689,"GO:1901137",7.70148243100093e-21,1,17,17,"carbohydrate derivative biosynthetic process","BP",5.72086739561068e-20,"carbohydrate derivative metabolic process","Up"
"599",690,"GO:0044283",1.09339921886363e-20,1,17,17,"small molecule biosynthetic process","BP",8.1048362034536e-20,"regulation of small molecule metabolic process","Up"
"600",691,"GO:0022613",1.18455436378198e-20,1,17,17,"ribonucleoprotein complex biogenesis","BP",8.77122351995346e-20,"vesicle organization","Up"
"601",692,"GO:0002684",1.19503867485352e-20,1,17,17,"positive regulation of immune system process","BP",8.83949242034506e-20,"regulation of immune response","Up"
"602",693,"GO:0050769",1.30761329426064e-20,1,17,17,"positive regulation of neurogenesis","BP",9.66196292482228e-20,"negative regulation of neurogenesis","Up"
"603",694,"GO:0097485",1.39730273363696e-20,1,17,17,"neuron projection guidance","BP",1.03137762493372e-19,"response to nutrient","Up"
"604",695,"GO:0022604",1.44384470941366e-20,1,17,17,"regulation of cell morphogenesis","BP",1.06460701675121e-19,"post-embryonic animal organ morphogenesis","Up"
"605",696,"GO:0007568",1.51426105073263e-20,1,17,17,"aging","BP",1.11417734153906e-19,"aging","Up"
"606",697,"GO:0043254",1.55559832531457e-20,1,17,17,"regulation of protein-containing complex assembly","BP",1.1433893053574e-19,"vesicle organization","Up"
"607",698,"GO:0043207",1.58086663240291e-20,1,17,17,"response to external biotic stimulus","BP",1.15952337465858e-19,"response to bacterium","Up"
"608",699,"GO:0051707",1.58086663240291e-20,1,17,17,"response to other organism","BP",1.15952337465858e-19,"response to bacterium","Up"
"609",700,"GO:0006518",1.90138662167141e-20,1,17,17,"peptide metabolic process","BP",1.38878709357191e-19,"regulation of amide metabolic process","Up"
"610",701,"GO:0043604",1.90138662167141e-20,1,17,17,"amide biosynthetic process","BP",1.38878709357191e-19,"regulation of amide metabolic process","Up"
"611",703,"GO:0002164",2.1144354259461e-20,1,17,17,"larval development","BP",1.539573294517e-19,"nematode larval development","Up"
"612",704,"GO:0010256",2.33046481905807e-20,1,17,17,"endomembrane system organization","BP",1.69510396308178e-19,"vesicle organization","Up"
"613",705,"GO:0007548",2.38524322201639e-20,1,17,17,"sex differentiation","BP",1.73314450331544e-19,"development of primary sexual characteristics","Up"
